{
  "name": "User Authentication Flow",
  "description": "Secure login/signup for web and mobile users",
  "display_on": ["Login", "Signup"],
  "content": {
    "problem": "Users cannot access the platform. No account system exists. This blocks all personalized features.",
    "users": "New users who want to create accounts and returning users who need to log in.",
    "user_stories": [
      {
        "id": "US-001",
        "story": "As a new user, I want to create an account, so that I can access personalized features",
        "acceptance": [
          "Can enter email and password",
          "Email validation prevents invalid formats",
          "Password requirements are clearly displayed",
          "Receives confirmation after successful signup"
        ]
      },
      {
        "id": "US-002",
        "story": "As a returning user, I want to log in, so that I can access my saved data",
        "acceptance": [
          "Can enter email and password",
          "Successful login redirects to dashboard",
          "Invalid credentials show clear error message"
        ]
      },
      {
        "id": "US-003",
        "story": "As a logged-in user, I want to stay logged in, so that I don't have to re-enter credentials every visit",
        "acceptance": [
          "Session persists across browser restarts",
          "Can manually log out when needed",
          "Session expires after 30 days of inactivity"
        ]
      }
    ],
    "constraints": "Must comply with GDPR for EU users. No SMS verification due to cost. Launch within Q1.",
    "out_of_scope": [
      "Social login (Google, Facebook)",
      "Two-factor authentication",
      "Password recovery flow",
      "Admin user management"
    ],
    "success_criteria": [
      "95% of signup attempts complete successfully",
      "Login errors provide actionable guidance",
      "Session persists for 30 days on trusted devices",
      "Zero security vulnerabilities in auth flow"
    ]
  }
}
